{
  "candidate_id": "dw-transform-v0-normalizer-consolidation",
  "transformation_type": "maintainability",
  "preservation_claim": "All 10 exported normalizer function signatures remain identical. All valid inputs produce the same outputs. All invalid inputs produce the same error messages (including the sourceType-specific suffix). No type changes. No behavioral changes.",
  "baseline_measurement": {
    "metric": "lines_of_code_normalizer_section",
    "value": 126,
    "measurement_method": "count lines 129-254 in runtime/core/v0.ts before transformation"
  },
  "result_measurement": {
    "metric": "lines_of_code_normalizer_section",
    "value": 55,
    "measurement_method": "count lines 129-183 in runtime/core/v0.ts after transformation"
  },
  "comparison_summary": "126 lines reduced to 55 lines (56% reduction). 10 copy-paste normalizer functions replaced by 1 factory + 10 one-line declarations. File total: 277 lines → 205 lines (26% overall reduction). All exports preserved. TypeScript typecheck passes. Production build passes. Mirror sync passes.",
  "rollback_verification": "Revert v0.ts and its Mission Control mirror to pre-transformation state via git revert. Mirror sync checker (check:directive-runtime-sync) confirms both copies stay aligned.",
  "regression_checks": [
    { "check_name": "check:directive-runtime-sync", "result": "pass" },
    { "check_name": "check:directive-transformation-proof", "result": "pass" },
    { "check_name": "typecheck", "result": "pass" },
    { "check_name": "build", "result": "pass" }
  ]
}
